{
  "case_id": "CASE-0001",
  "created_at": "2026-03-29T20:46:00Z",
  "source_system": "github_issue",
  "source_event_id": "prettybusysolutions-eng/xzenia-attestation#issue-1",
  "recommendation": "Create and close the first full attestation loop in this repository under governed review.",
  "verification_path": "github://prettybusysolutions-eng/xzenia-attestation/issues/1",
  "status": "open",
  "evidence": [
    {
      "type": "repo",
      "ref": "https://github.com/prettybusysolutions-eng/xzenia-attestation"
    }
  ]
}
